{
  "schema_version": "1.0",
  "template_id": "spring-boot-full",
  "template_version": "0.5.0",
  "key_files": [
    {"path": "pom.xml", "sha256": "b28d8588885e3b9ebd3ecd1fa444ce9c11e53eb4acd43c2d169271a5ab18057f"},
    {"path": "src/main/java/com/example/Application.java", "sha256": "1682207361418499dc312ddbad326ed833302afcf20c51efe5f69d6154e00681"}
  ],
  "protected_paths": [
    ".sdlc-pipeline/lifecycle.json",
    ".sdlc-pipeline/scaffold.json",
    "pom.xml",
    "mvnw",
    "mvnw.cmd"
  ],
  "extension_points": [
    {"id": "spring-controller", "path": "src/main/java/com/example/*/api"},
    {"id": "spring-service", "path": "src/main/java/com/example/*/service"},
    {"id": "spring-domain", "path": "src/main/java/com/example/*/domain"},
    {"id": "spring-test", "path": "src/test/java"}
  ],
  "allowed_paths": [
    "src/main/java",
    "src/test/java",
    "src/main/resources"
  ],
  "lifecycle_hash": "27ceff540205aa2efd5730bab3677f5f2a24c69c7e4cad62f39dc0c687e8838b",
  "capabilities": ["spring-web", "validation", "actuator-health", "auth-example"]
}
